{
  "schemaVersion": 1,
  "updatedAt": "2026-02-19T00:00:00.000Z",
  "basics": {
    "fullName": "Cristian Camilo Romero",
    "contact": {
      "address": "",
      "city": "Bogotá D.C",
      "state": "Colombia",
      "zip": "",
      "email": "cristian.c.romero.p@gmail.com",
      "phone": "+57 3148554726"
    }
  },
  "education": [
    {
      "id": "3749218a-39e8-4ea3-bc5c-f55dd69aa2cf",
      "institution": "Fundación Universitaria del Área Andina",
      "location": "Bogotá, Colombia",
      "degree": "Ingeniería de Sistemas",
      "concentration": "",
      "gpa": "",
      "graduationDate": "Octubre 2021",
      "thesis": "",
      "coursework": "Medalla de Excelencia WorldSkills 2018 en Tecnologías Web",
      "studyAbroad": null,
      "order": 0
    },
    {
      "id": "1b34126d-c7f7-4598-8531-8971cbb656af",
      "institution": "Servicio Nacional de Aprendizaje (SENA)",
      "location": "Soacha, Cundinamarca, Colombia",
      "degree": "Tecnólogo en Análisis y Desarrollo de Sistemas de Información",
      "concentration": "Tecnología de la información",
      "gpa": "",
      "graduationDate": "Agosto 2018",
      "thesis": "",
      "coursework": "",
      "studyAbroad": null,
      "order": 1
    },
    {
      "id": "d2f3e719-70bc-49e0-8f3e-74c4f5d3a826",
      "institution": "Servicio Nacional de Aprendizaje (SENA)",
      "location": "Soacha, Cundinamarca, Colombia",
      "degree": "Técnico en Programación de Software",
      "concentration": "",
      "gpa": "",
      "graduationDate": "Octubre 2016",
      "thesis": "",
      "coursework": "",
      "studyAbroad": null,
      "order": 2
    },
    {
      "id": "20735fe6-772d-4216-9751-3bdf432ed27b",
      "institution": "Platzi",
      "location": "",
      "degree": "Curso de React Avanzado",
      "concentration": "Ingeniería de software",
      "gpa": "",
      "graduationDate": "Agosto 2022",
      "thesis": "",
      "coursework": "",
      "studyAbroad": null,
      "order": 3
    },
    {
      "id": "0f23653b-47fe-4223-9156-507008fd65d6",
      "institution": "Platzi",
      "location": "",
      "degree": "Complejidad Algorítmica",
      "concentration": "Ingeniería de software",
      "gpa": "",
      "graduationDate": "Enero 2022",
      "thesis": "",
      "coursework": "",
      "studyAbroad": null,
      "order": 4
    }
  ],
  "experience": [
    {
      "id": "a332e008-e1ae-4b75-a3f2-3e60f77fa324",
      "organization": "VTEX",
      "title": "Software Engineer II - Full Stack",
      "location": "Bogotá, Colombia",
      "dates": "Enero 2024 – Octubre 2025",
      "bullets": [
        "Lideré decisiones de arquitectura y diseñé RFCs técnicas, ejecutando estimaciones de impacto para evaluar la viabilidad técnica de nuevos desarrollos.",
        "Participé en la definición de métricas de negocio y estrategias de producto, colaborando con equipos de producto y stakeholders para priorizar features según su impacto en el negocio.",
        "Propuse e implementé trunk-based development como git flow del equipo, diseñando una RFC con el proceso completo, configurando reglas de ramas e implementando un sistema de versionado con tags para CI/CD.",
        "Mejoré el proceso de Pull Requests del equipo: implementé conventional commits, plantillas de PR, mínimo 2 revisores obligatorios e integración con Slack para mejorar la comunicación asíncrona entre stakeholders.",
        "Investigué e impulsé la implementación de CI/CD con GitHub Actions, Tekton y Vercel, creando POCs y una RFC detallada. Refactoricé la configuración de Turborepo del monorepo: variables de entorno, pipelines (check types, test, linter, build) por cada app y package.",
        "Establecí cultura de code reviews estructurados y testing automatizado (Vitest, Playwright), aumentando cobertura de tests y mejorando la calidad de los entregables del equipo.",
        "Lideré ceremonias semanales de 1 hora para elevar el nivel técnico del equipo: compartí buenas prácticas de principios SOLID, patrones de diseño y uso correcto de TypeScript, revisando errores comunes en PRs. Presenté mensualmente el progreso en métricas registradas en GetDX.",
        "Mentoricé equipo de desarrolladores internos y externos (3 third-party), estableciendo estándares de code review, testing automatizado y documentación técnica centralizada en Backstage.",
        "Establecí y documenté los principios de arquitectura (patrones de composición, estructura de carpetas, convenciones de nombrado) para el equipo Frontend, homogenizando el código en 6 aplicaciones.",
        "Implementé un sistema de logging estructurado para mejorar la observabilidad y el rastreo de errores en la API. Investigué y documenté la migración de CloudWatch a OpenSearch y Grafana, apoyando al desarrollador en la implementación.",
        "Mejoré significativamente la documentación del producto: documenté APIs existentes, creé RFCs para múltiples features, registré incidencias de producción con análisis de causa raíz, y documenté la API Tracking Protocol. Lideré la iniciativa de migrar la documentación técnica a Backstage.io (plataforma interna Darkkitchen de VTEX).",
        "Enseñé al equipo buenas prácticas de monorepos con Turborepo y mejoré progresivamente la arquitectura de cada app para seguir separación por capas con una estructura consistente entre apps de frontend y backend.",
        "Promoví e implementé una cultura de on-call en el equipo, estableciendo procesos para el manejo de incidencias, prioridades y registro de métricas para identificar y actuar sobre errores comunes.",
        "Lideré junto con otros 2 compañeros a 3 desarrolladores third-party, velando por el cumplimiento de pautas y entregas solicitadas.",
        "Realicé revisiones de PRs diariamente.",